{
  "name": "saude-do-idoso",
  "version": 1,
  "start_step_id": "quedas",
  "steps": [
    {
      "id": "quedas",
      "prompt": "Teve alguma queda nos últimos 12 meses?",
      "answer_type": "boolean",
      "branches": {
        "true": "medicamentos",
        "false": "medicamentos"
      },
      "weights": {
        "true": 5,
        "false": 0
      }
    },
    {
      "id": "medicamentos",
      "prompt": "Quantos medicamentos diferentes você toma por dia?",
      "answer_type": "integer"
    }
  ],
  "scoring": {
    "type": "weighted",
    "thresholds": {
      "baixa": 0,
      "alta": 5
    },
    "priority_map": {
      "baixa": 9,
      "alta": 5
    }
  },
  "offer": {
    "title": "Saúde do idoso",
    "eligibility": {
      "gte": [
        "profile.age",
        60
      ]
    },
    "retake_after_days": 365
  },
  "suggestions": [
    {
      "protocol": "saude-mental-aprofundada",
      "when": {
        "gte": [
          "outcome.score",
          15
        ]
      }
    }
  ],
  "scheduling": [
    {
      "when": {
        "eq": [
          "outcome.tier",
          "alta"
        ]
      },
      "appointment_type": "consulta_medica",
      "priority": "routine",
      "due_in_days": 30
    }
  ]
}
